{
  "meta": {
    "microcosm_version": "0.1.0-beta.1",
    "schema_version": "mir/v0.0",
    "run_id": "run-baseline",
    "generated_at": "2026-06-07T10:00:00Z",
    "generator_version": "kernel/v0.0.0"
  },
  "project": {"id": "project.x", "name": "x", "root": "."},
  "nodes": [],
  "edges": [],
  "assertions": [],
  "observations": [],
  "policies": [],
  "evidence": [],
  "findings": []
}
